{
  "cycles": [],
  "edges": [
    {
      "from": "T001",
      "kind": "phase",
      "to": "T002"
    },
    {
      "from": "T002",
      "kind": "phase",
      "to": "T003"
    },
    {
      "from": "T002",
      "kind": "phase",
      "to": "T004"
    },
    {
      "from": "T002",
      "kind": "phase",
      "to": "T005"
    },
    {
      "from": "T003",
      "kind": "explicit",
      "to": "T005"
    },
    {
      "from": "T003",
      "kind": "phase",
      "to": "T006"
    },
    {
      "from": "T004",
      "kind": "phase",
      "to": "T006"
    },
    {
      "from": "T005",
      "kind": "phase",
      "to": "T006"
    }
  ],
  "feature": "042-session-refresh",
  "schema_version": 1,
  "source_path": "specs/042-session-refresh/tasks.md",
  "tasks": [
    {
      "checked": true,
      "depends_on": [],
      "id": "T001",
      "line": 12,
      "parallel": false,
      "phase": "Setup",
      "phase_index": 0,
      "story": null,
      "title": "Create auth package skeleton in packages/auth/",
      "write_domains": [
        "packages/auth/**"
      ]
    },
    {
      "checked": true,
      "depends_on": [
        "T001"
      ],
      "id": "T002",
      "line": 18,
      "parallel": false,
      "phase": "Foundational",
      "phase_index": 1,
      "story": null,
      "title": "Add token family table migration in db/migrations/0042_token_family.sql",
      "write_domains": [
        "db/migrations/**"
      ]
    },
    {
      "checked": false,
      "depends_on": [
        "T002"
      ],
      "id": "T003",
      "line": 24,
      "parallel": true,
      "phase": "User Story 1",
      "phase_index": 2,
      "story": "US1",
      "title": "Implement refresh token rotation in packages/auth/refresh.py",
      "write_domains": [
        "packages/auth/refresh.py"
      ]
    },
    {
      "checked": false,
      "depends_on": [
        "T002"
      ],
      "id": "T004",
      "line": 25,
      "parallel": true,
      "phase": "User Story 1",
      "phase_index": 2,
      "story": "US1",
      "title": "Add session refresh endpoint in apps/api/session/refresh.py",
      "write_domains": [
        "apps/api/session/**"
      ]
    },
    {
      "checked": false,
      "depends_on": [
        "T002",
        "T003"
      ],
      "id": "T005",
      "line": 26,
      "parallel": false,
      "phase": "User Story 1",
      "phase_index": 2,
      "story": "US1",
      "title": "Invalidate the token family on duplicate use in packages/auth/refresh.py",
      "write_domains": [
        "packages/auth/refresh.py"
      ]
    },
    {
      "checked": false,
      "depends_on": [
        "T003",
        "T004",
        "T005"
      ],
      "id": "T006",
      "line": 31,
      "parallel": false,
      "phase": "Polish",
      "phase_index": 3,
      "story": null,
      "title": "Document refresh semantics in docs/architecture/session.md",
      "write_domains": [
        "docs/architecture/session.md"
      ]
    }
  ],
  "warnings": [
    {
      "code": "SHARED_WRITE_DOMAIN",
      "line": 26,
      "message": "T003 and T005 both write packages/auth/refresh.py; they run in separate waves",
      "task_id": "T005"
    }
  ],
  "waves": [
    [
      "T001"
    ],
    [
      "T002"
    ],
    [
      "T003",
      "T004"
    ],
    [
      "T005"
    ],
    [
      "T006"
    ]
  ]
}
